{"conformanceStatusDigest":"sha256:06f5ccc4357ea884fe3ca08900d2b5e6fb19977f66f8f1a5289d7f8a7771fde5","controlSurfaceDigest":"sha256:dd92303b38d856a144e36165c81480f733ca5de7d79cfca1a4809920ebc4e0b9","kernelCommit":"69253a78f095572b727c2336644b03fbff5476c8","kernelRelease":"@shedu/promotion-kernel@0.4.0-experimental","mechanismInventoryDigest":"sha256:7a46155a8e39fdd902ca8f6133a3adab16b6f033f9043316dac1c12990ba6239","schemaVersion":"conformance-attestation@1","signing":{"algorithm":"ed25519","publicKey":"146566b79911ee63307b287c0df8ad726da12c94fec15ae104fd563ae0857555","signature":"dd9b8d0663a79c26d3e7ec60a4ff2682ef9061249f1756334e69008fe37025fb59eea38842d303bcc1c997272aa09e788b73751749d7028bfd8aea8690a5a80f"}}
